Address,Date
浦东新区杨辉村,['2022-04-02']
浦东新区新奉公路122弄,"['2022-04-02', '2022-04-01']"
浦东新区新川路625弄,"['2022-04-02', '2022-04-01']"
浦东新区千汇路750弄,"['2022-04-02', '2022-03-30', '2022-03-26']"
浦东新区龙汇路1880弄,['2022-04-02']
浦东新区祥安路36弄,['2022-04-02']
浦东新区乳山二村,['2022-04-02']
浦东新区千汇路32弄,['2022-04-02']
浦东新区行德路141弄,"['2022-04-02', '2022-03-29']"
浦东新区长清路773弄,['2022-04-02']
浦东新区金亭公路619号,"['2022-04-02', '2022-03-29']"
浦东新区尚博路366弄,['2022-04-02']
浦东新区兰谷路2777弄,"['2022-04-02', '2022-03-30']"
浦东新区北中路354弄,"['2022-04-02', '2022-03-29', '2022-03-27']"
浦东新区高桥村江家宅,['2022-04-02']
浦东新区浦东大道2740弄,['2022-04-02']
浦东新区上南四村,['2022-04-02']
浦东新区大众村王家宅,['2022-04-02']
浦东新区西泥路113弄,['2022-04-02']
浦东新区红四村,['2022-04-02']
浦东新区云山路1045弄,['2022-04-02']
浦东新区夏碧路79弄,['2022-04-02']
浦东新区海春路150弄,"['2022-04-02', '2022-03-30']"
浦东新区浦东大道275弄,"['2022-04-02', '2022-04-01']"
浦东新区项文路333弄,"['2022-04-02', '2022-04-01', '2022-03-26']"
浦东新区荣科路177弄,['2022-04-02']
浦东新区沪南路3468弄,['2022-04-02']
浦东新区杨高北路4705弄,['2022-04-02']
浦东新区御北路235号工地生活区,"['2022-04-02', '2022-04-01', '2022-03-30', '2022-03-29']"
浦东新区民雨路333弄,['2022-04-02']
浦东新区笋心路10号,['2022-04-02']
浦东新区新路村,['2022-04-02']
浦东新区周秀路26弄,"['2022-04-02', '2022-04-01', '2022-03-29']"
浦东新区东八灶,['2022-04-02']
浦东新区荷泽路25弄,"['2022-04-02', '2022-03-29']"
浦东新区芳华路916弄,"['2022-04-02', '2022-04-01', '2022-03-30', '2022-03-29', '2022-03-26', '2022-03-24']"
浦东新区崮山路968号,"['2022-04-02', '2022-03-30']"
浦东新区汇成路1245弄,['2022-04-02']
浦东新区陈行村一队张家宅,['2022-04-02']
浦东新区民同路176弄,"['2022-04-02', '2022-03-23']"
浦东新区唐陆路石家观音堂,['2022-04-02']
浦东新区三林镇金家宅,['2022-04-02']
浦东新区新春村,['2022-04-02']
浦东新区康沈路1527弄,"['2022-04-02', '2022-03-30', '2022-03-29']"
浦东新区沪南公路2000号,['2022-04-02']
浦东新区滨海一村西顾家宅,['2022-04-02']
浦东新区长达村,['2022-04-02']
浦东新区成山路1712号,['2022-04-02']
浦东新区沪南路4851弄,"['2022-04-02', '2022-04-01', '2022-03-30']"
浦东新区上南路东明路工地生活区,['2022-04-02']
浦东新区天花庵村闵北队闵家宅,['2022-04-02']
浦东新区新镇村谢家宅,['2022-04-02']
浦东新区华路村七队蔡家宅,['2022-04-02']
浦东新区沪南路235号工地生活区,['2022-04-02']
浦东新区沪南公路5192号,['2022-04-02']
浦东新区张江镇中心村王家宅,['2022-04-02']
浦东新区御桥村姚家宅,"['2022-04-02', '2022-03-30', '2022-03-27', '2022-03-26', '2022-03-23']"
浦东新区长桥村南乔家宅,"['2022-04-02', '2022-03-29']"
浦东新区环林西路613弄,['2022-04-02']
浦东新区大沟村西王家宅,['2022-04-02']
浦东新区宣镇东路625弄,['2022-04-02']
浦东新区潘姚村西刘队刘家宅,['2022-04-02']
浦东新区前进村西李家宅,"['2022-04-02', '2022-03-27']"
浦东新区芳芯路149弄,['2022-04-02']
浦东新区周东路529号,['2022-04-02']
浦东新区德州路254号,['2022-04-02']
浦东新区新环北路1080弄,['2022-04-02']
浦东新区李桥村,['2022-04-02']
浦东新区唐四村王家东宅,['2022-04-02']
浦东新区成山路475弄,"['2022-04-02', '2022-03-29']"
浦东新区上南三村,"['2022-04-02', '2022-03-26']"
浦东新区庆星八队西圈夏家宅,['2022-04-02']
浦东新区南码头路238弄,['2022-04-02']
浦东新区虹二村沈家宅,['2022-04-02']
浦东新区民雪路108弄,"['2022-04-02', '2022-04-01']"
浦东新区妙境路595弄,['2022-04-02']
浦东新区东园三村,"['2022-04-02', '2022-03-30', '2022-03-29']"
浦东新区东靖路119弄,['2022-04-02']
浦东新区秋岚路48弄,['2022-04-02']
浦东新区共和村陈家宅,"['2022-04-02', '2022-04-01', '2022-03-29']"
浦东新区齐爱路99弄,['2022-04-02']
浦东新区浦东大道1615号,['2022-04-02']
浦东新区庆星村二队费家宅,['2022-04-02']
浦东新区新农村沈家宅,"['2022-04-02', '2022-04-01']"
浦东新区凤家码头夏家宅,['2022-04-02']
浦东新区拱扱路2626弄,['2022-04-02']
浦东新区东建路228弄,['2022-04-02']
浦东新区陈家弄,['2022-04-02']
浦东新区玉盘北路281号,['2022-04-02']
浦东新区民贤路28弄,['2022-04-02']
浦东新区环林东路799,['2022-04-02']
浦东新区秀沿路1177弄二支弄,['2022-04-02']
浦东新区光泽路120弄,"['2022-04-02', '2022-04-01', '2022-03-26']"
浦东新区秀沿路2571弄,['2022-04-02']
浦东新区申江南路3266号,['2022-04-02']
浦东新区航鹤路1000弄,['2022-04-02']
浦东新区虹二村朱家宅,['2022-04-02']
浦东新区瑞和路101弄,"['2022-04-02', '2022-04-01']"
浦东新区高桥村一队唐家宅,['2022-04-02']
浦东新区灵山路730弄,['2022-04-02']
浦东新区周阳路399弄,['2022-04-02']
浦东新区年家浜路501弄,['2022-04-02']
浦东新区成日村,"['2022-04-02', '2022-03-26']"
浦东新区佳林路115弄,"['2022-04-02', '2022-04-01', '2022-03-29']"
浦东新区航头路1137弄,['2022-04-02']
浦东新区红三村一队唐家宅,['2022-04-02']
浦东新区海院新村,['2022-04-02']
浦东新区东陆路1755弄,['2022-04-02']
浦东新区潍坊六村,"['2022-04-02', '2022-04-01', '2022-03-27']"
浦东新区张家浜路98弄,['2022-04-02']
浦东新区莱阳路2328弄,"['2022-04-02', '2022-04-01']"
浦东新区高科西路961号,"['2022-04-02', '2022-04-01', '2022-03-29']"
浦东新区牡丹路186弄,['2022-04-02']
浦东新区花山路609弄,"['2022-04-02', '2022-04-01', '2022-03-30']"
浦东新区孙建路815弄,['2022-04-02']
浦东新区汇成路1118号,['2022-04-02']
浦东新区芳芯路175弄,['2022-04-02']
浦东新区唐四村费家宅,['2022-04-02']
浦东新区下南路465弄,"['2022-04-02', '2022-03-26']"
浦东新区虹三村五队赵家宅,['2022-04-02']
浦东新区长丰村四队北唐家宅,['2022-04-02']
浦东新区东风村,"['2022-04-02', '2022-03-30', '2022-03-29']"
浦东新区康安路御北路交界口工地生活区,"['2022-04-02', '2022-04-01', '2022-03-30', '2022-03-29', '2022-03-26']"
浦东新区秋霞路200弄,['2022-04-02']
浦东新区临江村西新队小金家宅,['2022-04-02']
浦东新区唐兴路191弄,"['2022-04-02', '2022-04-01']"
浦东新区锦绣路888弄,['2022-04-02']
浦东新区东方路2993弄,['2022-04-02']
浦东新区航头路1675弄,"['2022-04-02', '2022-03-26']"
浦东新区海阳路1318弄,['2022-04-02']
浦东新区张杨北路2899号,['2022-04-02']
浦东新区六里新村,"['2022-04-02', '2022-03-26', '2022-03-24']"
浦东新区沈梅路300弄,['2022-04-02']
浦东新区方竹路423弄,['2022-04-02']
浦东新区张杨路951号,['2022-04-02']
浦东新区尚博路518弄,['2022-04-02']
浦东新区城南路1385弄,['2022-04-02']
浦东新区凌兆路530弄,"['2022-04-02', '2022-03-30']"
浦东新区洋溢村,"['2022-04-02', '2022-03-26']"
浦东新区胶东路266弄,['2022-04-02']
浦东新区三林镇高树队汤家宅,['2022-04-02']
浦东新区微山二村,"['2022-04-02', '2022-04-01', '2022-03-30', '2022-03-29']"
浦东新区三八路115弄,['2022-04-02']
浦东新区吴店村郭家宅,['2022-04-02']
浦东新区振东苑,['2022-04-02']
浦东新区城西路104号,['2022-04-02']
浦东新区新虹村瞿家宅,"['2022-04-02', '2022-03-30']"
浦东新区上浦路36弄,"['2022-04-02', '2022-03-26']"
浦东新区三林路1662弄,['2022-04-02']
浦东新区上钢二村,"['2022-04-02', '2022-03-26']"
浦东新区东明路560弄,['2022-04-02']
浦东新区诚礼路298弄,"['2022-04-02', '2022-03-30']"
浦东新区浦东大道3号,['2022-04-02']
浦东新区康安路280号工地生活区,['2022-04-02']
浦东新区红枫路300弄,"['2022-04-02', '2022-04-01']"
浦东新区南码头路10号工地生活区,['2022-04-02']
浦东新区浙桥路208号,['2022-04-02']
浦东新区风桥村,['2022-04-02']
浦东新区浦三路288弄,"['2022-04-02', '2022-03-30']"
浦东新区牡丹路399弄,['2022-04-02']
浦东新区银山路72弄,"['2022-04-02', '2022-03-30', '2022-03-29']"
浦东新区南六公路399弄,['2022-04-02']
浦东新区庆丰村,"['2022-04-02', '2022-03-30', '2022-03-29']"
浦东新区惠东路342弄,"['2022-04-02', '2022-04-01', '2022-03-26']"
浦东新区航城五路401弄,"['2022-04-02', '2022-04-01']"
浦东新区崮山路626弄,['2022-04-02']
浦东新区天花庵村卫家队,"['2022-04-02', '2022-03-23']"
浦东新区南码头路1521弄,"['2022-04-02', '2022-03-30', '2022-03-26']"
浦东新区天花庵村大雪队,['2022-04-02']
浦东新区民耀路358弄,"['2022-04-02', '2022-04-01']"
浦东新区南新村,"['2022-04-02', '2022-03-29', '2022-03-26', '2022-03-24']"
浦东新区东方路2851弄,['2022-04-02']
浦东新区沪南路3161弄,"['2022-04-02', '2022-03-24']"
浦东新区齐河路909弄,"['2022-04-02', '2022-03-29']"
浦东新区沪南路4855弄,['2022-04-02']
浦东新区和平村罗家宅,['2022-04-02']
闵行区北江燕路228弄,"['2022-04-02', '2022-03-27', '2022-03-22']"
闵行区沧源路755弄,"['2022-04-02', '2022-03-26']"
闵行区漕宝路1508弄,"['2022-04-02', '2022-03-27']"
闵行区春申路2458弄,"['2022-04-02', '2022-03-27', '2022-03-22']"
闵行区灯辉路1169弄,"['2022-04-02', '2022-04-01', '2022-03-30', '2022-03-27', '2022-03-26']"
闵行区东川路333弄,['2022-04-02']
闵行区东兰路1349弄,"['2022-04-02', '2022-03-27']"
闵行区东兰路220号,['2022-04-02']
闵行区东兰路37弄,['2022-04-02']
闵行区都会路258号,"['2022-04-02', '2022-03-30', '2022-03-27']"
闵行区都会路2849号,['2022-04-02']
闵行区都市路3588弄,"['2022-04-02', '2022-03-30']"
闵行区放鹤路2323弄,"['2022-04-02', '2022-03-30', '2022-03-27', '2022-03-23']"
闵行区顾戴路1199弄,"['2022-04-02', '2022-04-01']"
闵行区顾戴路35弄,"['2022-04-02', '2022-04-01', '2022-03-26']"
闵行区顾戴路388弄,['2022-04-02']
闵行区航新路288号,"['2022-04-02', '2022-04-01']"
闵行区虹梅南路1555弄,"['2022-04-02', '2022-03-30', '2022-03-26', '2022-03-22']"
闵行区沪闵路3131弄,"['2022-04-02', '2022-03-30', '2022-03-27', '2022-03-26', '2022-03-23']"
闵行区华宝路789弄,['2022-04-02']
闵行区汇南村,"['2022-04-02', '2022-03-27']"
闵行区汇延路258弄,"['2022-04-02', '2022-04-01']"
闵行区建新村,"['2022-04-02', '2022-04-01']"
闵行区剑川路201弄,"['2022-04-02', '2022-03-30', '2022-03-27']"
闵行区江川路1777弄,"['2022-04-02', '2022-03-27']"
闵行区江川路241弄,"['2022-04-02', '2022-03-23']"
闵行区江川路680弄,"['2022-04-02', '2022-03-27']"
闵行区江汉路99弄,['2022-04-02']
闵行区金平路555弄,"['2022-04-02', '2022-04-01', '2022-03-27', '2022-03-26']"
闵行区近浦村,['2022-04-02']
闵行区莲花南路1388弄,"['2022-04-02', '2022-03-30']"
闵行区莲花南路565弄,"['2022-04-02', '2022-03-30']"
闵行区龙吴路3369号,"['2022-04-02', '2022-04-01']"
闵行区龙吴路5413弄,"['2022-04-02', '2022-03-26']"
闵行区龙吴路5530弄,"['2022-04-02', '2022-03-27', '2022-03-23']"
闵行区罗锦路75号,['2022-04-02']
闵行区罗锦路888弄,"['2022-04-02', '2022-03-22']"
闵行区梅陇二村,"['2022-04-02', '2022-03-27', '2022-03-23', '2022-03-22']"
闵行区梅陇西路1374号,['2022-04-02']
闵行区闵驰一路208弄,"['2022-04-02', '2022-03-27']"
闵行区南江燕路229弄,"['2022-04-02', '2022-03-26']"
闵行区平阳路59弄,['2022-04-02']
闵行区浦驰路188弄,"['2022-04-02', '2022-04-01', '2022-03-27']"
闵行区七莘路3333号,"['2022-04-02', '2022-03-30']"
闵行区三鲁公路5588弄,['2022-04-02']
闵行区申滨路1058弄,"['2022-04-02', '2022-03-27', '2022-03-23']"
闵行区莘建东路388弄,['2022-04-02']
闵行区疏影路758弄,"['2022-04-02', '2022-04-01', '2022-03-27', '2022-03-23']"
闵行区万源路986弄,"['2022-04-02', '2022-03-30']"
闵行区先新路1058弄,['2022-04-02']
闵行区向阳村,['2022-04-02']
闵行区银春路2200弄,"['2022-04-02', '2022-03-30', '2022-03-27', '2022-03-23', '2022-03-22']"
闵行区永德路228弄,"['2022-04-02', '2022-03-23']"
闵行区友建村,['2022-04-02']
闵行区跃农村,['2022-04-02']
闵行区中春路1288号,['2022-04-02']
闵行区中春路6689弄,"['2022-04-02', '2022-04-01', '2022-03-30', '2022-03-22']"
闵行区颛兴路639弄,"['2022-04-02', '2022-03-27']"
闵行区紫藤二村,"['2022-04-02', '2022-03-30']"
宝山区电台路559弄,['2022-04-02']
宝山区蕰川路1638号,['2022-04-02']
宝山区华灵路1781弄,['2022-04-02']
宝山区杨泰路192号,['2022-04-02']
宝山区长临路1118弄,['2022-04-02']
宝山区共和新路4719弄,"['2022-04-02', '2022-03-29', '2022-03-27', '2022-03-24']"
宝山区华秋路58弄,"['2022-04-02', '2022-03-29']"
宝山区南大路189弄,['2022-04-02']
宝山区美秀路558弄,"['2022-04-02', '2022-03-22']"
宝山区真金路1039弄,['2022-04-02']
宝山区北宗村,"['2022-04-02', '2022-03-30', '2022-03-27']"
宝山区宝杨路3288弄,"['2022-04-02', '2022-03-30']"
宝山区通南路237号,['2022-04-02']
宝山区场中路3656弄,['2022-04-02']
宝山区南大路68号,['2022-04-02']
宝山区行知路430号,['2022-04-02']
宝山区上大路178弄,['2022-04-02']
宝山区江杨南路2550弄,"['2022-04-02', '2022-03-30']"
宝山区新沪路1059弄,['2022-04-02']
嘉定区鹤槎路182号,['2022-04-02']
嘉定区宝安公路3799弄,['2022-04-02']
嘉定区宝塔路286号,['2022-04-02']
嘉定区曹安公路1798号,"['2022-04-02', '2022-03-27']"
嘉定区曹安公路2038号,['2022-04-02']
嘉定区曹安公路2098号,"['2022-04-02', '2022-03-27']"
嘉定区曹安公路3962号,['2022-04-02']
嘉定区槎溪路222弄,['2022-04-02']
嘉定区慈竹路69弄,['2022-04-02']
嘉定区德华路475号,['2022-04-02']
嘉定区芳林路819弄,['2022-04-02']
嘉定区丰庄西路460弄,['2022-04-02']
嘉定区阜康西路61号,['2022-04-02']
嘉定区沪太路7488弄,['2022-04-02']
嘉定区和静路1585弄,"['2022-04-02', '2022-03-30']"
嘉定区华江路129号,['2022-04-02']
嘉定区汇善路1333弄,"['2022-04-02', '2022-03-27', '2022-03-22']"
嘉定区嘉安公路509号,['2022-04-02']
嘉定区嘉罗公路2189号,['2022-04-02']
嘉定区嘉唐公路2442号,['2022-04-02']
嘉定区嘉唐公路826号,"['2022-04-02', '2022-03-29']"
嘉定区金耀路333弄,['2022-04-02']
嘉定区柳湖路773号,['2022-04-02']
嘉定区绿苑路218弄,['2022-04-02']
嘉定区梅川路1558弄,['2022-04-02']
嘉定区民丰路999号,['2022-04-02']
嘉定区墨玉北路899弄,['2022-04-02']
嘉定区彭封路365号,['2022-04-02']
嘉定区栖林路468弄,['2022-04-02']
嘉定区清河路205弄,"['2022-04-02', '2022-03-30', '2022-03-29']"
嘉定区胜辛北路1888弄,['2022-04-02']
嘉定区胜竹路1828弄,"['2022-04-02', '2022-03-29']"
嘉定区铜川路2688弄,"['2022-04-02', '2022-03-30']"
嘉定区万镇路1177弄,"['2022-04-02', '2022-03-30']"
嘉定区吴杨路100弄,"['2022-04-02', '2022-03-27', '2022-03-23', '2022-03-22']"
嘉定区武都路100弄,['2022-04-02']
嘉定区希望路978弄,['2022-04-02']
嘉定区新源路1008号,['2022-04-02']
嘉定区新源路1288弄,"['2022-04-02', '2022-04-01', '2022-03-30', '2022-03-26']"
嘉定区新源路588弄,"['2022-04-02', '2022-03-30']"
嘉定区安亭镇联群村,"['2022-04-02', '2022-03-30', '2022-03-29']"
嘉定区迎春新苑,['2022-04-02']
嘉定区华亭镇联一村,['2022-04-02']
嘉定区嘉定工业区南苑三村,['2022-04-02']
嘉定区马陆镇包桥村,"['2022-04-02', '2022-03-29']"
嘉定区北管村,['2022-04-02']
嘉定区江桥镇高潮村,"['2022-04-02', '2022-03-29', '2022-03-27']"
嘉定区李家楼,['2022-04-02']
松江区北松公路5768号,['2022-04-02']
松江区北闵路375号,['2022-04-02']
松江区北松公路6955弄,['2022-04-02']
松江区滨湖路585弄,"['2022-04-02', '2022-04-01']"
松江区仓丰路955弄,"['2022-04-02', '2022-04-01', '2022-03-30', '2022-03-29']"
松江区仓汇路401弄,"['2022-04-02', '2022-04-01', '2022-03-30', '2022-03-29']"
松江区草长浜路125弄,['2022-04-02']
松江区场东路66弄,['2022-04-02']
松江区场南路1弄,"['2022-04-02', '2022-03-27']"
松江区场西路61号,['2022-04-02']
松江区车亭公路1244号,['2022-04-02']
松江区辰塔路455弄,"['2022-04-02', '2022-03-30', '2022-03-29', '2022-03-27']"
松江区城置路257弄,"['2022-04-02', '2022-03-29']"
松江区淡家浜街99弄,['2022-04-02']
松江区德悦路501弄,['2022-04-02']
松江区东青村,['2022-04-02']
松江区洞伟路655弄,['2022-04-02']
松江区洞薛路518号,['2022-04-02']
松江区方塔北路629号,['2022-04-02']
松江区高技路430号,['2022-04-02']
松江区谷阳北路881弄,['2022-04-02']
松江区鼓浪路57号,"['2022-04-02', '2022-04-02']"
松江区横山村84号,['2022-04-02']
松江区弘翔路58弄,['2022-04-02']
松江区沪亭路53号,['2022-04-02']
松江区沪亭南路110号,['2022-04-02']
松江区华阳村,['2022-04-02']
松江区华莹山路450弄,['2022-04-02']
松江区环城路78号,['2022-04-02']
松江区汇桥村,"['2022-04-02', '2022-03-22']"
松江区健鹏路36号,['2022-04-02']
松江区金家村,"['2022-04-02', '2022-03-30']"
松江区金胜村,"['2022-04-02', '2022-03-29']"
松江区九舒路398号,"['2022-04-02', '2022-03-30']"
松江区九亭大街520号,['2022-04-02']
松江区九新公路341弄,['2022-04-02']
松江区九新公路989号,['2022-04-02']
松江区昆港公路2099弄,['2022-04-02']
松江区林荫路1288号,['2022-04-02']
松江区龙高路28号,['2022-04-02']
松江区龙金路278弄,['2022-04-02']
松江区卖新公路1699弄,['2022-04-02']
松江区求仁路388弄,"['2022-04-02', '2022-03-30']"
松江区虬泾路138号,['2022-04-02']
松江区虬泾路559弄,"['2022-04-02', '2022-03-29']"
松江区虬长路323弄,['2022-04-02']
松江区人民北路175号,['2022-04-02']
松江区荣乐东路1591号,['2022-04-02']
松江区荣乐中路30弄,"['2022-04-02', '2022-03-29', '2022-03-27']"
松江区荣乐中路63弄,['2022-04-02']
松江区佘北公路1458号,['2022-04-02']
松江区书林路600弄,['2022-04-02']
松江区思贤路1855弄,['2022-04-02']
松江区泗滨路666弄,['2022-04-02']
松江区泗凤路508弄,['2022-04-02']
松江区松东路193弄,['2022-04-02']
松江区松金公路10052号,"['2022-04-02', '2022-04-01']"
松江区松卫北路1959号,['2022-04-02']
松江区亭中路2号,['2022-04-02']
松江区同建村,['2022-04-02']
松江区同利路1号,['2022-04-02']
松江区文翔路928弄,['2022-04-02']
松江区西林北路890号,"['2022-04-02', '2022-04-01']"
松江区西林南路100弄,['2022-04-02']
松江区香亭路1200弄,['2022-04-02']
松江区翔昆路150弄,['2022-04-02']
松江区欣浪路745号,['2022-04-02']
松江区新北街209号,"['2022-04-02', '2022-03-30']"
松江区新车公路418号,['2022-04-02']
松江区兴达村,"['2022-04-02', '2022-03-30']"
松江区叶新公路6号,['2022-04-02']
松江区叶政路518弄,"['2022-04-02', '2022-03-30']"
松江区易富路1220号,['2022-04-02']
松江区影振路300号,['2022-04-02']
松江区泽悦路200号,['2022-04-02']
松江区赵非泾村,['2022-04-02']
松江区中山东路17弄,"['2022-04-02', '2022-03-29']"
松江区中山东路86弄,['2022-04-02']
松江区石湖荡镇中心村,['2022-04-02']
松江区竹亭路23号,['2022-04-02']
青浦区高泾路789弄,['2022-04-02']
青浦区光联一路480弄,"['2022-04-02', '2022-04-01']"
青浦区鹤江路421号,['2022-04-02']
青浦区华强街203弄,"['2022-04-02', '2022-04-01']"
青浦区华徐公路988号,['2022-04-02']
青浦区金姚村,['2022-04-02']
青浦区久远路1660弄,"['2022-04-02', '2022-03-27', '2022-03-26']"
青浦区明珠路980号,['2022-04-02']
青浦区青湖路458号,['2022-04-02']
青浦区金华新村,['2022-04-02']
青浦区青龙公路588号,['2022-04-02']
青浦区沈家浜路229号,['2022-04-02']
青浦区沈家浜路37号,['2022-04-02']
青浦区崧润路1029弄,['2022-04-02']
青浦区崧文路399弄,['2022-04-02']
青浦区外青松公路2772弄,['2022-04-02']
青浦区万寿路121号,"['2022-04-02', '2022-04-01']"
青浦区谢卫路158号,['2022-04-02']
青浦区新府中路1331弄,"['2022-04-02', '2022-03-30', '2022-03-23']"
青浦区盈港东路4709弄,"['2022-04-02', '2022-03-22']"
青浦区诸光路856弄,['2022-04-02']
青浦区徐南路300号,"['2022-04-02', '2022-03-30', '2022-03-29']"
青浦区诸光路488号,['2022-04-02']
奉贤区八字桥路288弄,"['2022-04-02', '2022-04-01', '2022-03-30']"
奉贤区金海公路99弄,"['2022-04-02', '2022-04-01', '2022-03-30']"
奉贤区八字桥路829弄,['2022-04-02']
奉贤区川南奉公路8029号,"['2022-04-02', '2022-04-01']"
奉贤区南奉公路142号,"['2022-04-02', '2022-04-01']"
奉贤区新奉公路2013号,['2022-04-02']
奉贤区墩头村,['2022-04-02']
奉贤区泰青公路119弄,['2022-04-02']
奉贤区富竹路39弄,['2022-04-02']
奉贤区八字桥路218弄,['2022-04-02']
奉贤区港极路568号,"['2022-04-02', '2022-04-01', '2022-03-30']"
奉贤区贤百路260弄,['2022-04-02']
奉贤区肖南路1268号,['2022-04-02']
奉贤区环城西路3311号,['2022-04-02']
奉贤区工农村,"['2022-04-02', '2022-03-29', '2022-03-27']"
奉贤区汇安小区,"['2022-04-02', '2022-03-29']"
奉贤区万顺路2475弄,['2022-04-02']
奉贤区联民村,['2022-04-02']
奉贤区西吴村,"['2022-04-02', '2022-04-01', '2022-03-30', '2022-03-29', '2022-03-27']"
奉贤区德政路299弄,['2022-04-02']
奉贤区青村人民路445弄,"['2022-04-02', '2022-03-30']"
奉贤区东门村,['2022-04-02']
奉贤区北唐新苑,['2022-04-02']
奉贤区育秀路1288弄,['2022-04-02']
奉贤区姚家村,"['2022-04-02', '2022-04-01', '2022-03-29', '2022-03-27']"
奉贤区沪杭公路113号,['2022-04-02']
奉贤区陆家桥村,"['2022-04-02', '2022-04-01', '2022-03-30', '2022-03-29', '2022-03-27']"
奉贤区永欣新村,['2022-04-02']
奉贤区正环路158弄,['2022-04-02']
奉贤区定康路205弄,"['2022-04-02', '2022-04-01']"
奉贤区解放村,"['2022-04-02', '2022-04-01', '2022-03-29', '2022-03-27']"
奉贤区航南公路1981弄,"['2022-04-02', '2022-04-01']"
奉贤区北唐村,['2022-04-02']
奉贤区西闸公路1678号,"['2022-04-02', '2022-03-29']"
奉贤区北行路555号,['2022-04-02']
奉贤区立新路136弄,['2022-04-02']
奉贤区二桥村,"['2022-04-02', '2022-03-30', '2022-03-24', '2022-03-22']"
奉贤区夏家村,"['2022-04-02', '2022-03-27']"
奉贤区镇西路1058号,['2022-04-02']
奉贤区国顺路668弄,['2022-04-02']
崇明区东新村,['2022-04-02']
崇明区凤滨路59弄,['2022-04-02']
崇明区进丰路南环路交叉口,['2022-04-02']
崇明区渔乐路500弄,['2022-04-02']
崇明区金滂路199弄,['2022-04-02']
崇明区凤西路潘圆公路路口,['2022-04-02']
崇明区北港村,['2022-04-02']
崇明区蟠南村,['2022-04-02']
崇明区大公村,['2022-04-02']
崇明区新中路505号,['2022-04-02']
黄浦区延安中路545弄,"['2022-04-01', '2022-03-30', '2022-03-27']"
黄浦区方浜中路523号,"['2022-04-01', '2022-03-30']"
黄浦区斜土路251弄,"['2022-04-01', '2022-03-30', '2022-03-29']"
黄浦区文庙路91号,['2022-04-01']
黄浦区高家横弄19弄,['2022-04-01']
黄浦区南塘浜路93弄,['2022-04-01']
黄浦区自忠路367号,['2022-04-01']
黄浦区中山南路315号,['2022-04-01']
黄浦区黄家路88弄,"['2022-04-01', '2022-03-30', '2022-03-29']"
黄浦区方浜西路45号,['2022-04-01']
黄浦区方浜西路47号,['2022-04-01']
黄浦区普育东路206号,['2022-04-01']
黄浦区金陵东路183号,['2022-04-01']
黄浦区金陵东路138弄,['2022-04-01']
黄浦区蓬莱路348号,['2022-04-01']
黄浦区瞿溪路1254号,['2022-04-01']
黄浦区徽宁路419号,['2022-04-01']
黄浦区大林路7号,['2022-04-01']
黄浦区学西街15号,['2022-04-01']
黄浦区淮海中路111号,['2022-04-01']
黄浦区瞿溪路34号,['2022-04-01']
徐汇区华展路55弄,"['2022-04-01', '2022-03-30', '2022-03-27']"
徐汇区龙吟路503弄,['2022-04-01']
徐汇区梅陇四村,"['2022-04-01', '2022-03-24', '2022-03-23', '2022-03-22']"
徐汇区钦州路428弄,['2022-04-01']
徐汇区裕德路66弄,"['2022-04-01', '2022-03-30']"
徐汇区安歆公寓,['2022-04-01']
徐汇区华侨新村,['2022-04-01']
徐汇区斜土路2365弄,['2022-04-01']
徐汇区虹漕路8号,['2022-04-01']
徐汇区漕宝路250号,"['2022-04-01', '2022-03-27']"
徐汇区桂平路350弄,"['2022-04-01', '2022-03-30']"
徐汇区宛平南路388弄,['2022-04-01']
徐汇区宜山路187号,"['2022-04-01', '2022-03-30']"
长宁区剑河路404弄,['2022-04-01']
长宁区镇宁路405弄（住宅）,"['2022-04-01', '2022-03-29']"
长宁区程桥一村,['2022-04-01']
长宁区安东小区,['2022-04-01']
长宁区虹桥路1017弄,['2022-04-01']
长宁区泉口路185弄,['2022-04-01']
长宁区剑河路599弄,['2022-04-01']
长宁区虹古路380弄,['2022-04-01']
长宁区长宁路396弄（住宅）,['2022-04-01']
长宁区福泉路495弄（住宅）,['2022-04-01']
长宁区平武路150弄,['2022-04-01']
长宁区虹桥路1041弄,"['2022-04-01', '2022-03-30']"
长宁区延安西路1228号,['2022-04-01']
长宁区娄山关路999弄,['2022-04-01']
