Address,Date
浦东新区三八路94弄,['2022-04-04']
浦东新区三角街82弄,['2022-04-04']
浦东新区三民村曹阳队汤家宅,['2022-04-04']
浦东新区森林村杨家宅,['2022-04-04']
浦东新区商城路1025弄,['2022-04-04']
浦东新区上川路620弄,['2022-04-04']
浦东新区上南路6869弄,['2022-04-04']
浦东新区双桥路218弄,"['2022-04-04', '2022-04-03', '2022-04-02']"
浦东新区硕川路125弄,"['2022-04-04', '2022-04-01']"
浦东新区思浦路15弄,['2022-04-04']
浦东新区思学路470弄,"['2022-04-04', '2022-04-01']"
浦东新区思学路55弄,['2022-04-04']
浦东新区松林路88弄,['2022-04-04']
浦东新区孙桥路235弄,"['2022-04-04', '2022-03-26']"
浦东新区孙桥路306号,['2022-04-04']
浦东新区台儿庄路666弄,['2022-04-04']
浦东新区太平村,"['2022-04-04', '2022-04-03', '2022-04-02', '2022-04-01', '2022-03-30']"
浦东新区汤巷中心村,"['2022-04-04', '2022-04-02', '2022-04-01', '2022-03-29']"
浦东新区桃林路299弄,"['2022-04-04', '2022-04-02', '2022-04-01']"
浦东新区天花庵村闵西队闵家宅,['2022-04-04']
浦东新区听锦路36弄,"['2022-04-04', '2022-04-03']"
浦东新区听康路181弄,['2022-04-04']
浦东新区听民路242弄,"['2022-04-04', '2022-04-03']"
浦东新区听悦路686弄,"['2022-04-04', '2022-03-24', '2022-03-22']"
浦东新区通济路1279弄,['2022-04-04']
浦东新区通济路47弄,"['2022-04-04', '2022-04-01', '2022-03-29']"
浦东新区万安街333弄,['2022-04-04']
浦东新区万德路50弄,['2022-04-04']
浦东新区万德路52弄,['2022-04-04']
浦东新区王楼村,"['2022-04-04', '2022-04-03', '2022-04-02', '2022-03-29']"
浦东新区潍坊路116号,['2022-04-04']
浦东新区潍坊路256号,['2022-04-04']
浦东新区五莲路326号,['2022-04-04']
浦东新区五星村唐家宅,['2022-04-04']
浦东新区五星村徐家队顾家宅,"['2022-04-04', '2022-04-01', '2022-03-24']"
浦东新区五星村徐家队奚家宅,"['2022-04-04', '2022-03-29', '2022-03-23']"
浦东新区西林村庙桥队庙桥新宅,['2022-04-04']
浦东新区西门路121弄,"['2022-04-04', '2022-03-29']"
浦东新区西门路7号,['2022-04-04']
浦东新区西泰林路480弄,['2022-04-04']
浦东新区西营路102号,['2022-04-04']
浦东新区西营南路18弄,"['2022-04-04', '2022-04-01']"
浦东新区西营南路68弄,"['2022-04-04', '2022-04-03', '2022-04-02', '2022-04-01', '2022-03-30']"
浦东新区奚家村杨家宅,['2022-04-04']
浦东新区下南路276弄,"['2022-04-04', '2022-04-03', '2022-04-02', '2022-03-29', '2022-03-26']"
浦东新区向东村顾家宅,"['2022-04-04', '2022-03-30']"
浦东新区向东村唐家宅,['2022-04-04']
浦东新区项隶村,['2022-04-04']
浦东新区小湾村小湾新宅,['2022-04-04']
浦东新区小湾村张家宅,['2022-04-04']
浦东新区新安村,"['2022-04-04', '2022-04-02', '2022-03-29', '2022-03-27', '2022-03-26']"
浦东新区新浜村李家宅,['2022-04-04']
浦东新区新川路899弄,"['2022-04-04', '2022-03-30']"
浦东新区新川路995弄,"['2022-04-04', '2022-03-29']"
浦东新区新春村南王家宅,"['2022-04-04', '2022-03-30']"
浦东新区新村路59弄,"['2022-04-04', '2022-04-01', '2022-03-29']"
浦东新区新德西路511弄,"['2022-04-04', '2022-04-01', '2022-03-29', '2022-03-27']"
浦东新区新瀚路65弄,['2022-04-04']
浦东新区新虹村东包家宅,"['2022-04-04', '2022-03-30', '2022-03-29']"
浦东新区新虹村刘家宅,"['2022-04-04', '2022-04-01']"
浦东新区新虹村陆家宅,['2022-04-04']
浦东新区新环北路1333弄,"['2022-04-04', '2022-03-29']"
浦东新区新环西路27号,"['2022-04-04', '2022-04-02']"
浦东新区新环西路800弄,['2022-04-04']
浦东新区新浦路346弄,['2022-04-04']
浦东新区新浦路380弄,"['2022-04-04', '2022-03-26']"
浦东新区新浦路673弄,"['2022-04-04', '2022-03-29', '2022-03-27', '2022-03-26', '2022-03-23']"
浦东新区新生村金家宅,"['2022-04-04', '2022-04-03']"
浦东新区新生村陆家宅,['2022-04-04']
浦东新区新行路433弄,"['2022-04-04', '2022-04-03', '2022-03-24']"
浦东新区星火村陆家宅,['2022-04-04']
浦东新区行南路900弄,"['2022-04-04', '2022-03-29']"
浦东新区兴东村季家宅,['2022-04-04']
浦东新区秀浦路788弄,"['2022-04-04', '2022-04-03', '2022-03-30']"
浦东新区秀沿路1028弄,"['2022-04-04', '2022-04-03', '2022-03-26']"
浦东新区宣镇东路815弄,['2022-04-04']
浦东新区学北路337弄,['2022-04-04']
浦东新区严民路221弄,['2022-04-04']
浦东新区严桥路141弄,"['2022-04-04', '2022-04-01', '2022-03-30', '2022-03-26']"
浦东新区杨东村西潘家宅,['2022-04-04']
浦东新区杨高北路1887弄,"['2022-04-04', '2022-04-02']"
浦东新区杨高北路5291弄,"['2022-04-04', '2022-04-03', '2022-03-29', '2022-03-22']"
浦东新区杨高南路2068号,['2022-04-04']
浦东新区杨高中路10弄,"['2022-04-04', '2022-04-03', '2022-04-02', '2022-04-01', '2022-03-30']"
浦东新区杨思北街118弄,"['2022-04-04', '2022-04-03', '2022-04-01']"
浦东新区杨思路430弄,['2022-04-04']
浦东新区洋泾镇路117号,"['2022-04-04', '2022-04-01', '2022-03-29', '2022-03-26']"
浦东新区药师村二队曹家宅,['2022-04-04']
浦东新区药师村二队周家宅,['2022-04-04']
浦东新区一六村,"['2022-04-04', '2022-04-03']"
浦东新区一心村缪家宅,['2022-04-04']
浦东新区一心村徐家宅,"['2022-04-04', '2022-04-01']"
浦东新区亦园路75弄,['2022-04-04']
浦东新区益民村三村宅,['2022-04-04']
浦东新区益民路19弄,['2022-04-04']
浦东新区懿德村吴家队吴家宅,['2022-04-04']
浦东新区懿德村小瞿家队小瞿家宅,['2022-04-04']
浦东新区银霄路39弄,['2022-04-04']
浦东新区樱花路469弄,['2022-04-04']
浦东新区营房村高路二宅,['2022-04-04']
浦东新区营房村青晏一宅,['2022-04-04']
浦东新区营前村二组费家宅,['2022-04-04']
浦东新区永红村一队李家宅,['2022-04-04']
浦东新区永乐村,"['2022-04-04', '2022-04-02', '2022-03-30', '2022-03-29']"
浦东新区永泰路182号,"['2022-04-04', '2022-04-01']"
浦东新区友谊村,"['2022-04-04', '2022-03-27']"
浦东新区羽山路100弄,"['2022-04-04', '2022-04-01', '2022-03-29']"
浦东新区羽山路1950弄,"['2022-04-04', '2022-04-02', '2022-03-29']"
浦东新区源深路836号,['2022-04-04']
浦东新区云端路1388弄,['2022-04-04']
浦东新区云莲路415弄,['2022-04-04']
浦东新区云山路1395弄,"['2022-04-04', '2022-04-03', '2022-03-29']"
浦东新区运河路269号,['2022-04-04']
浦东新区韵浦路167弄,"['2022-04-04', '2022-03-30', '2022-03-29']"
浦东新区枣庄路552弄,"['2022-04-04', '2022-04-02']"
浦东新区展凌路58弄,"['2022-04-04', '2022-04-01', '2022-03-29']"
浦东新区张杨北路5428弄,"['2022-04-04', '2022-04-01']"
浦东新区张杨北路555弄,"['2022-04-04', '2022-04-03', '2022-04-02', '2022-03-30', '2022-03-29']"
浦东新区张杨路1348号,['2022-04-04']
浦东新区张杨路3083弄,['2022-04-04']
浦东新区张杨路77号,['2022-04-04']
浦东新区赵行村龚家宅,['2022-04-04']
浦东新区赵行村杨家宅,['2022-04-04']
浦东新区振兴路110号,['2022-04-04']
浦东新区直属村凌北宅,['2022-04-04']
浦东新区中界村复兴队陈家宅,"['2022-04-04', '2022-04-01']"
浦东新区中界村高桥队秦家宅,"['2022-04-04', '2022-03-29']"
浦东新区中界村季家队苏家宅,['2022-04-04']
浦东新区中界村秦家宅,"['2022-04-04', '2022-04-03']"
浦东新区中久村,"['2022-04-04', '2022-04-03', '2022-04-01', '2022-03-26']"
浦东新区中科路2195弄,['2022-04-04']
浦东新区中圩村陈家宅,['2022-04-04']
浦东新区众安路779弄,['2022-04-04']
浦东新区众三村顾家宅,['2022-04-04']
浦东新区周东村,['2022-04-04']
浦东新区周东路123弄,"['2022-04-04', '2022-04-03', '2022-03-29']"
浦东新区周东路137号,['2022-04-04']
浦东新区周市路1321号,"['2022-04-04', '2022-04-03', '2022-04-02', '2022-04-01', '2022-03-30', '2022-03-29', '2022-03-29']"
浦东新区周市路380弄,"['2022-04-04', '2022-04-02', '2022-03-29']"
浦东新区周市路66号,"['2022-04-04', '2022-04-03', '2022-04-02', '2022-03-30', '2022-03-29']"
浦东新区周泰路68弄,['2022-04-04']
浦东新区周阳路339弄,['2022-04-04']
浦东新区周园北路522弄,['2022-04-04']
浦东新区竹柏路100弄,"['2022-04-04', '2022-03-24', '2022-03-22']"
浦东新区竹柏路758弄,['2022-04-04']
浦东新区祝家港路225弄,['2022-04-04']
浦东新区紫薇路667弄,['2022-04-04']
闵行区安宁路400弄,['2022-04-04']
闵行区报春路388弄,"['2022-04-04', '2022-04-03', '2022-03-30']"
闵行区北江燕路68弄,['2022-04-04']
闵行区北吴路501弄,"['2022-04-04', '2022-04-03', '2022-04-02']"
闵行区北翟路1555号,['2022-04-04']
闵行区碧江路501弄,"['2022-04-04', '2022-04-03', '2022-04-02', '2022-03-30', '2022-03-27', '2022-03-26']"
闵行区碧江路502弄,"['2022-04-04', '2022-03-30', '2022-03-26']"
闵行区曹家塘路399弄,"['2022-04-04', '2022-04-03']"
闵行区春都路88弄,"['2022-04-04', '2022-04-03', '2022-04-02', '2022-04-01', '2022-03-30']"
闵行区东川路800号,"['2022-04-04', '2022-03-27', '2022-03-26', '2022-03-23', '2022-03-22']"
闵行区东川路811弄,"['2022-04-04', '2022-03-26']"
闵行区东兰路307号,"['2022-04-04', '2022-04-02']"
闵行区东兰路751弄,"['2022-04-04', '2022-03-26']"
闵行区都会路2799弄,"['2022-04-04', '2022-04-03', '2022-04-02', '2022-03-30', '2022-03-27']"
闵行区都会路3199弄,"['2022-04-04', '2022-04-03', '2022-04-02', '2022-04-01', '2022-03-30', '2022-03-27']"
闵行区都会路3888弄,"['2022-04-04', '2022-04-02']"
闵行区都市路2899弄,"['2022-04-04', '2022-04-03', '2022-04-02']"
闵行区繁兴路469弄,"['2022-04-04', '2022-04-01', '2022-03-27']"
闵行区富国路39弄,"['2022-04-04', '2022-04-01', '2022-03-27']"
闵行区富岩路328弄,"['2022-04-04', '2022-03-30', '2022-03-27']"
闵行区古美西路631弄,['2022-04-04']
闵行区古美西路753弄,"['2022-04-04', '2022-04-03']"
闵行区光明村,['2022-04-04']
闵行区贵都路345弄,['2022-04-04']
闵行区鹤庆路411弄,"['2022-04-04', '2022-03-30', '2022-03-26']"
闵行区虹梅路1111弄,"['2022-04-04', '2022-04-03', '2022-03-30']"
闵行区虹梅路2964弄,['2022-04-04']
闵行区虹梅南路1661弄,['2022-04-04']
闵行区虹梅南路1728弄,"['2022-04-04', '2022-03-30', '2022-03-22']"
闵行区虹梅南路4828号,"['2022-04-04', '2022-03-27']"
闵行区虹梅南路4999弄,['2022-04-04']
闵行区虹莘路1935弄,['2022-04-04']
闵行区虹莘路1955弄,"['2022-04-04', '2022-03-30']"
闵行区虹莘路2288弄,"['2022-04-04', '2022-04-03', '2022-03-30']"
闵行区虹莘路3800弄,['2022-04-04']
闵行区沪光路180弄,['2022-04-04']
闵行区华光路300弄,"['2022-04-04', '2022-03-27']"
闵行区华美路100弄,"['2022-04-04', '2022-03-30']"
闵行区华美路60弄,['2022-04-04']
闵行区环镇南路200弄,['2022-04-04']
闵行区黄桦路369弄,['2022-04-04']
闵行区黄桦路422弄,"['2022-04-04', '2022-03-30', '2022-03-27']"
闵行区汇中村,"['2022-04-04', '2022-04-03', '2022-04-02']"
闵行区剑川路150弄,"['2022-04-04', '2022-04-03', '2022-04-02', '2022-03-27', '2022-03-26', '2022-03-23', '2022-03-22']"
闵行区剑川路198弄,"['2022-04-04', '2022-04-01', '2022-03-30', '2022-03-27', '2022-03-23', '2022-03-22']"
闵行区剑川路50弄,"['2022-04-04', '2022-04-03', '2022-04-02', '2022-03-30', '2022-03-27', '2022-03-22']"
闵行区剑川路99号,['2022-04-04']
闵行区江川东路863弄,"['2022-04-04', '2022-03-27']"
闵行区江汉路751弄,"['2022-04-04', '2022-03-30']"
闵行区金平路777弄,"['2022-04-04', '2022-04-03', '2022-03-26']"
闵行区金平路788弄,"['2022-04-04', '2022-04-03', '2022-03-30', '2022-03-27']"
闵行区金星村,['2022-04-04']
闵行区金阳路366弄,"['2022-04-04', '2022-04-02']"
闵行区景谷路176弄,"['2022-04-04', '2022-04-03']"
闵行区景联路685号,['2022-04-04']
闵行区兰坪路190弄,['2022-04-04']
闵行区莲花路1058弄,"['2022-04-04', '2022-04-01', '2022-03-30']"
闵行区莲花路310弄,"['2022-04-04', '2022-04-03', '2022-04-02']"
闵行区莲花路528弄,"['2022-04-04', '2022-04-03', '2022-04-02']"
闵行区莲花南路431弄,"['2022-04-04', '2022-04-03', '2022-03-30', '2022-03-27', '2022-03-22']"
闵行区联合村,"['2022-04-04', '2022-04-03', '2022-04-02']"
闵行区联青路51弄,"['2022-04-04', '2022-03-27']"
闵行区联青路699弄,"['2022-04-04', '2022-04-02', '2022-04-01', '2022-03-27']"
闵行区联星村,"['2022-04-04', '2022-04-03', '2022-04-02']"
闵行区龙柏六村,['2022-04-04']
闵行区龙吴路3188号,"['2022-04-04', '2022-04-03', '2022-04-02']"
闵行区龙吴路4787弄,"['2022-04-04', '2022-04-03', '2022-04-02', '2022-03-30', '2022-03-27']"
闵行区龙吴路5511弄,"['2022-04-04', '2022-04-03', '2022-04-02', '2022-04-01', '2022-03-27', '2022-03-26', '2022-03-23', '2022-03-22']"
闵行区宁虹路1101弄,"['2022-04-04', '2022-04-03', '2022-04-02']"
闵行区平阳路300弄,"['2022-04-04', '2022-04-03', '2022-04-02']"
闵行区平阳路50弄,"['2022-04-04', '2022-04-01']"
闵行区浦驰路235弄,"['2022-04-04', '2022-04-01', '2022-03-30']"
闵行区浦锦路2161弄,"['2022-04-04', '2022-04-03']"
闵行区浦星公路568弄,"['2022-04-04', '2022-04-03', '2022-04-02', '2022-03-22']"
闵行区浦秀路1139弄,['2022-04-04']
闵行区普乐路333弄,"['2022-04-04', '2022-04-03']"
闵行区普乐路425弄,"['2022-04-04', '2022-04-02', '2022-03-27', '2022-03-23', '2022-03-22']"
闵行区七莘路1507号,"['2022-04-04', '2022-04-03']"
闵行区勤俭村,"['2022-04-04', '2022-04-02', '2022-04-01']"
闵行区沁春路1366弄,"['2022-04-04', '2022-04-03', '2022-04-01']"
闵行区青杉路417弄,"['2022-04-04', '2022-04-03', '2022-04-01']"
闵行区群英路88弄,"['2022-04-04', '2022-03-27', '2022-03-22']"
闵行区瑞丽路918弄,['2022-04-04']
闵行区申北路350弄,"['2022-04-04', '2022-04-03', '2022-04-01', '2022-03-30']"
闵行区莘北路255弄,['2022-04-04']
闵行区双柏路1710弄,"['2022-04-04', '2022-03-30']"
闵行区塘口村,"['2022-04-04', '2022-04-01', '2022-03-30', '2022-03-27', '2022-03-26', '2022-03-23']"
闵行区塘湾村,"['2022-04-04', '2022-04-02', '2022-04-01', '2022-03-30', '2022-03-27', '2022-03-26', '2022-03-23']"
闵行区天山西路4178弄,"['2022-04-04', '2022-03-27', '2022-03-23']"
闵行区天山西路4358弄,['2022-04-04']
闵行区通海路328弄,"['2022-04-04', '2022-04-02']"
闵行区通海路394号,['2022-04-04']
闵行区万源路2289弄,"['2022-04-04', '2022-04-02']"
闵行区王泥浜村,"['2022-04-04', '2022-04-03', '2022-04-02', '2022-03-26']"
闵行区吴河路333号,"['2022-04-04', '2022-03-27']"
闵行区吴中路830弄,"['2022-04-04', '2022-04-03', '2022-03-30']"
闵行区吴中路870弄,"['2022-04-04', '2022-03-27']"
闵行区吴中路970弄,['2022-04-04']
闵行区西新路58弄,['2022-04-04']
闵行区新建村,"['2022-04-04', '2022-04-03', '2022-04-02', '2022-04-01', '2022-03-30', '2022-03-27', '2022-03-26', '2022-03-23']"
闵行区新闵路481弄,"['2022-04-04', '2022-04-03']"
闵行区新源路1422号,"['2022-04-04', '2022-04-01']"
闵行区新源路3122弄,['2022-04-04']
闵行区新源路3211弄,"['2022-04-04', '2022-04-02']"
闵行区新镇路603弄,"['2022-04-04', '2022-04-03', '2022-03-27']"
闵行区鑫都路2535弄,"['2022-04-04', '2022-04-03', '2022-04-02', '2022-04-01', '2022-03-27']"
闵行区鑫都路2688弄,['2022-04-04']
闵行区星火村,"['2022-04-04', '2022-03-27']"
闵行区许泾村,"['2022-04-04', '2022-04-03', '2022-04-02', '2022-04-01', '2022-03-30', '2022-03-26']"
闵行区雅致路228弄,"['2022-04-04', '2022-04-03']"
闵行区盐铁塘路272弄,"['2022-04-04', '2022-04-03']"
闵行区银春路1800弄,"['2022-04-04', '2022-04-03', '2022-04-02', '2022-04-01', '2022-03-30', '2022-03-27', '2022-03-26']"
闵行区银都路2188弄,"['2022-04-04', '2022-04-03']"
闵行区银都路3151弄,"['2022-04-04', '2022-04-03', '2022-03-27', '2022-03-22']"
闵行区银都路3828弄,"['2022-04-04', '2022-03-27']"
闵行区银康路750弄,"['2022-04-04', '2022-03-27']"
闵行区银康路76弄,"['2022-04-04', '2022-04-03', '2022-03-27']"
闵行区友好村,"['2022-04-04', '2022-04-02', '2022-04-01', '2022-03-27', '2022-03-26']"
闵行区俞塘村,"['2022-04-04', '2022-04-02', '2022-04-01', '2022-03-27', '2022-03-22']"
闵行区赵家村,"['2022-04-04', '2022-04-03']"
闵行区镇北村,"['2022-04-04', '2022-04-03']"
闵行区中春路3455弄,"['2022-04-04', '2022-04-01']"
闵行区颛建路248号,"['2022-04-04', '2022-04-03', '2022-04-02']"
闵行区颛盛路135弄,"['2022-04-04', '2022-04-02']"
闵行区颛兴路345弄,"['2022-04-04', '2022-03-30']"
闵行区颛兴路666弄,"['2022-04-04', '2022-04-02', '2022-03-30', '2022-03-23', '2022-03-22']"
闵行区紫光路801弄,"['2022-04-04', '2022-04-01', '2022-03-23']"
宝山区宝林八村,['2022-04-04']
宝山区华灵路1225弄,"['2022-04-04', '2022-04-03']"
宝山区宝钢二村,['2022-04-04']
宝山区莲花山路517弄,"['2022-04-04', '2022-04-03', '2022-04-02', '2022-03-30', '2022-03-29', '2022-03-27']"
宝山区宝安公路325号,"['2022-04-04', '2022-04-03']"
宝山区宝林六村,"['2022-04-04', '2022-04-03', '2022-03-30']"
宝山区丰皓路658弄,['2022-04-04']
宝山区光明村,['2022-04-04']
宝山区长临路1318弄,"['2022-04-04', '2022-03-27']"
宝山区罗芬路98弄,"['2022-04-04', '2022-04-03']"
宝山区陆翔路3489弄,"['2022-04-04', '2022-04-03']"
宝山区华灵路1681弄,"['2022-04-04', '2022-04-03']"
宝山区锦秋路1601弄,"['2022-04-04', '2022-03-24', '2022-03-22']"
宝山区韶山路348弄,"['2022-04-04', '2022-04-03', '2022-03-30']"
宝山区共康六村,"['2022-04-04', '2022-04-03']"
宝山区泰和西路3381弄,"['2022-04-04', '2022-04-03', '2022-03-29']"
宝山区环镇北路699弄,['2022-04-04']
宝山区新沪路285弄,"['2022-04-04', '2022-03-22']"
宝山区通河七村,"['2022-04-04', '2022-04-03', '2022-03-29']"
宝山区美康路818弄,['2022-04-04']
宝山区三泉路1859弄,"['2022-04-04', '2022-04-03']"
宝山区春雷路354弄,['2022-04-04']
宝山区海滨七村,"['2022-04-04', '2022-04-03']"
宝山区月富路218弄,['2022-04-04']
宝山区淞滨支路120弄,"['2022-04-04', '2022-04-03', '2022-03-30']"
宝山区爱辉路28弄,['2022-04-04']
宝山区呼玛四村,"['2022-04-04', '2022-04-03', '2022-03-29']"
宝山区塔源路150弄,['2022-04-04']
宝山区淞滨路803弄,['2022-04-04']
宝山区共富一村,"['2022-04-04', '2022-04-03']"
宝山区联杨路3606弄,['2022-04-04']
宝山区宝钢三村,['2022-04-04']
宝山区宝山七村,"['2022-04-04', '2022-04-03']"
宝山区泗塘七村,"['2022-04-04', '2022-04-03']"
宝山区共和新路5308弄,['2022-04-04']
宝山区蕰川路1498弄,"['2022-04-04', '2022-03-24']"
宝山区华秋路666号,['2022-04-04']
宝山区淞南二村,"['2022-04-04', '2022-03-30']"
宝山区绥化路201弄,"['2022-04-04', '2022-04-03', '2022-03-29']"
宝山区环镇北路700弄,"['2022-04-04', '2022-04-03', '2022-03-30']"
宝山区菊太路777弄,['2022-04-04']
宝山区淞南路211弄,['2022-04-04']
宝山区沪太路6790号,"['2022-04-04', '2022-04-03', '2022-03-30']"
宝山区呼玛三村,"['2022-04-04', '2022-04-03', '2022-04-02', '2022-03-27']"
宝山区顾北东路188弄,"['2022-04-04', '2022-04-03']"
宝山区北金村,"['2022-04-04', '2022-04-03', '2022-03-30']"
宝山区宝东路888弄,['2022-04-04']
宝山区聚丰园路628弄,"['2022-04-04', '2022-04-02']"
宝山区菊太路999弄,"['2022-04-04', '2022-04-03', '2022-03-30', '2022-03-22']"
宝山区鄂尔多斯路98弄,"['2022-04-04', '2022-04-03']"
宝山区镇东新村,['2022-04-04']
宝山区海江路667弄,['2022-04-04']
宝山区泰和西路3493弄,['2022-04-04']
宝山区淞南九村,"['2022-04-04', '2022-04-03', '2022-04-01']"
宝山区共富二村,"['2022-04-04', '2022-04-02', '2022-03-30', '2022-03-29', '2022-03-27']"
宝山区祁华路300弄,"['2022-04-04', '2022-04-03', '2022-03-27']"
宝山区通河一村,"['2022-04-04', '2022-04-03', '2022-03-29', '2022-03-24']"
宝山区红林路158弄,['2022-04-04']
宝山区场北路39弄,"['2022-04-04', '2022-04-03']"
宝山区杨泰路2158弄,['2022-04-04']
宝山区杨泰三村,"['2022-04-04', '2022-03-29']"
宝山区友谊路2858弄,"['2022-04-04', '2022-03-26']"
宝山区泰和路1415号,['2022-04-04']
宝山区红林路576弄,"['2022-04-04', '2022-04-03', '2022-03-30']"
宝山区共和新路4739弄,['2022-04-04']
宝山区沪太路5798号,['2022-04-04']
宝山区陆翔路3500弄,['2022-04-04']
宝山区宝山十村,['2022-04-04']
宝山区恒高路128弄,['2022-04-04']
宝山区铁城路1555号,"['2022-04-04', '2022-04-03', '2022-04-02', '2022-04-01', '2022-03-30', '2022-03-27']"
宝山区沪太路1585弄,['2022-04-04']
宝山区老安村,"['2022-04-04', '2022-04-03', '2022-03-30', '2022-03-29']"
宝山区江杨南路2500弄,"['2022-04-04', '2022-04-03', '2022-03-30']"
宝山区勤丰村,"['2022-04-04', '2022-04-03', '2022-03-29']"
宝山区塘西街398弄,"['2022-04-04', '2022-04-03', '2022-03-29']"
宝山区菊联路150号,['2022-04-04']
宝山区三星村,"['2022-04-04', '2022-04-03']"
宝山区泗塘四村,"['2022-04-04', '2022-04-03', '2022-03-27', '2022-03-24']"
宝山区月罗公路88号,"['2022-04-04', '2022-04-03']"
宝山区大华二路308号,['2022-04-04']
宝山区真华路1116号,['2022-04-04']
宝山区新二路1088弄,"['2022-04-04', '2022-03-30']"
宝山区菊盛路186弄,['2022-04-04']
宝山区布长街52弄,"['2022-04-04', '2022-04-03']"
宝山区春雷路331弄,['2022-04-04']
宝山区国权北路829弄,['2022-04-04']
宝山区淞兴西路98号,['2022-04-04']
宝山区萧云路99弄,['2022-04-04']
宝山区城银路555弄,['2022-04-04']
宝山区逸仙路3808号,"['2022-04-04', '2022-03-30']"
宝山区罗溪路1079弄,['2022-04-04']
宝山区永顺路81弄,"['2022-04-04', '2022-03-30']"
宝山区呼玛路528号,['2022-04-04']
宝山区淞南五村,"['2022-04-04', '2022-04-03', '2022-04-02', '2022-03-30', '2022-03-27', '2022-03-24']"
宝山区江杨南路2058号,"['2022-04-04', '2022-04-03', '2022-03-30']"
宝山区石太路2888号,"['2022-04-04', '2022-04-03']"
宝山区罗河路855弄,['2022-04-04']
宝山区罗溪路1185弄,['2022-04-04']
宝山区真华路1030弄,"['2022-04-04', '2022-04-03', '2022-03-22']"
宝山区宝林二村,['2022-04-04']
宝山区月罗公路888号,['2022-04-04']
宝山区通南路91弄,['2022-04-04']
宝山区潘新路255弄,"['2022-04-04', '2022-03-27']"
宝山区真大路333弄,['2022-04-04']
宝山区长江西路1240号,['2022-04-04']
宝山区海笛路199弄,"['2022-04-04', '2022-03-29']"
宝山区瑞丰路456弄,['2022-04-04']
宝山区罗太路530弄,['2022-04-04']
宝山区东西巷街189号,"['2022-04-04', '2022-03-30']"
宝山区爱辉路61号,['2022-04-04']
宝山区杨泰路55弄,['2022-04-04']
宝山区淞良路525号,['2022-04-04']
宝山区永清新村,['2022-04-04']
宝山区潘桥村,"['2022-04-04', '2022-03-30', '2022-03-29']"
宝山区张桥街33弄,['2022-04-04']
宝山区菊泉街1280弄,"['2022-04-04', '2022-03-30', '2022-03-29']"
宝山区宝钢十村,['2022-04-04']
宝山区湄星路1955号,['2022-04-04']
宝山区行知路693号,['2022-04-04']
宝山区祁北东路85弄,"['2022-04-04', '2022-04-03']"
宝山区锦秋路1366号,['2022-04-04']
宝山区水产路2700弄,['2022-04-04']
宝山区通河八村,['2022-04-04']
宝山区松兰路879号,['2022-04-04']
宝山区长江西路1000号,"['2022-04-04', '2022-03-30']"
宝山区共康七村,"['2022-04-04', '2022-03-29']"
宝山区长征新村,['2022-04-04']
宝山区陈川路777弄,['2022-04-04']
宝山区集贤路501弄,"['2022-04-04', '2022-04-03', '2022-03-29']"
宝山区花红村,['2022-04-04']
宝山区吉浦路521号,"['2022-04-04', '2022-03-29']"
宝山区罗芬路1088号,['2022-04-04']
宝山区真金路1106号,"['2022-04-04', '2022-03-30']"
宝山区顾北东路39弄,"['2022-04-04', '2022-04-03', '2022-03-30']"
宝山区杨泰路861号,['2022-04-04']
宝山区蕴川路1498号,['2022-04-04']
宝山区沪太路6040号,['2022-04-04']
宝山区通南路251号,['2022-04-04']
宝山区东太路498号,['2022-04-04']
宝山区永顺路28弄,['2022-04-04']
宝山区塔源路302弄,"['2022-04-04', '2022-04-03']"
宝山区宝杨路2035号,['2022-04-04']
宝山区宝钢四村,['2022-04-04']
宝山区一二八纪念路782号,['2022-04-04']
宝山区通河六村,"['2022-04-04', '2022-03-30']"
宝山区石太路2700号,['2022-04-04']
宝山区虎林路533号,['2022-04-04']
宝山区大黄村,['2022-04-04']
宝山区四方村,"['2022-04-04', '2022-04-03', '2022-03-30']"
宝山区毛家弄村,['2022-04-04']
宝山区四元路20弄,['2022-04-04']
宝山区一二八纪念路967弄,['2022-04-04']
宝山区陆翔路698弄,"['2022-04-04', '2022-03-30']"
宝山区湄浦村,"['2022-04-04', '2022-04-03', '2022-03-29']"
宝山区华灵路1351弄,['2022-04-04']
宝山区宝杨路2021弄,['2022-04-04']
宝山区杨泰路99弄,"['2022-04-04', '2022-04-03', '2022-03-30', '2022-03-29']"
宝山区月狮村,['2022-04-04']
宝山区锦秋路1588弄,"['2022-04-04', '2022-04-02']"
宝山区德都路28弄,"['2022-04-04', '2022-04-03', '2022-04-01']"
宝山区松兰路198弄,"['2022-04-04', '2022-04-03', '2022-03-29']"
嘉定区嘉年路119弄,['2022-04-04']
嘉定区嘉怡路279弄,['2022-04-04']
嘉定区嘉怡路233号,['2022-04-04']
嘉定区曹安公路1986号,"['2022-04-04', '2022-04-03', '2022-04-02', '2022-03-30', '2022-03-27']"
