Address,Date
黄浦区,"['2022-04-05', '2022-04-04', '2022-04-03', '2022-04-02', '2022-04-01', '2022-03-30', '2022-03-29', '2022-03-27', '2022-03-26', '2022-03-24', '2022-03-23', '2022-03-22']"
黄浦区白渡路288弄,['2022-04-05']
黄浦区保屯路135号,['2022-04-05']
黄浦区保屯路50弄,"['2022-04-05', '2022-04-03']"
黄浦区北京东路121号,['2022-04-05']
黄浦区北京东路123号,"['2022-04-05', '2022-04-03']"
黄浦区北京东路135号,['2022-04-05']
黄浦区北京东路288弄,['2022-04-05']
黄浦区北京东路355号,['2022-04-05']
黄浦区北京东路360弄,"['2022-04-05', '2022-04-04', '2022-03-30']"
黄浦区北京东路431弄,"['2022-04-05', '2022-04-04']"
黄浦区北京西路218弄,"['2022-04-05', '2022-04-04']"
黄浦区曹家街25号,"['2022-04-05', '2022-04-02']"
黄浦区曹家街30号,"['2022-04-05', '2022-04-01']"
黄浦区曹家街33号,"['2022-04-05', '2022-04-02']"
黄浦区曹家街40弄,"['2022-04-05', '2022-03-29']"
黄浦区曹家街44号,['2022-04-05']
黄浦区曹家街48弄,"['2022-04-05', '2022-04-01']"
黄浦区曹家街55弄,"['2022-04-05', '2022-04-02', '2022-04-01']"
黄浦区曹家街61号,['2022-04-05']
黄浦区曹家街62号,"['2022-04-05', '2022-04-01']"
黄浦区曹市弄15弄,"['2022-04-05', '2022-03-27']"
黄浦区曹市弄23弄,"['2022-04-05', '2022-04-02']"
黄浦区曹市弄33弄,"['2022-04-05', '2022-03-30']"
黄浦区曹市弄39弄,['2022-04-05']
黄浦区成都北路152弄,['2022-04-05']
黄浦区成都北路162弄,"['2022-04-05', '2022-04-04']"
黄浦区成都北路262弄,"['2022-04-05', '2022-04-04']"
黄浦区成都南路132弄,"['2022-04-05', '2022-04-04']"
黄浦区成都南路142弄,['2022-04-05']
黄浦区打浦路15号,['2022-04-05']
黄浦区打浦路303弄,['2022-04-05']
黄浦区打浦路316弄,"['2022-04-05', '2022-04-04', '2022-04-03', '2022-04-03', '2022-04-01', '2022-03-30', '2022-03-29']"
黄浦区打浦路339弄,"['2022-04-05', '2022-04-04', '2022-04-03', '2022-04-01', '2022-03-30', '2022-03-29', '2022-03-27']"
黄浦区打浦路398弄,"['2022-04-05', '2022-04-04']"
黄浦区打浦路399号,"['2022-04-05', '2022-04-03', '2022-03-30']"
黄浦区打浦路480弄,['2022-04-05']
黄浦区打浦路500弄,"['2022-04-05', '2022-04-04', '2022-04-03', '2022-04-01', '2022-03-27']"
黄浦区大夫坊36号,['2022-04-05']
黄浦区大夫坊74弄,"['2022-04-05', '2022-03-30']"
黄浦区大沽路141号,['2022-04-05']
黄浦区大沽路147号,['2022-04-05']
黄浦区大沽路155号,['2022-04-05']
黄浦区大沽路165号,['2022-04-05']
黄浦区大沽路191号,"['2022-04-05', '2022-04-04']"
黄浦区大吉路173弄,"['2022-04-05', '2022-03-26']"
黄浦区大吉路270号,"['2022-04-05', '2022-04-04']"
黄浦区大吉路310弄,['2022-04-05']
黄浦区大吉路36弄,['2022-04-05']
黄浦区大境路250号,['2022-04-05']
黄浦区大境路50号,"['2022-04-05', '2022-03-29']"
黄浦区大林路190号,"['2022-04-05', '2022-04-04']"
黄浦区大林路256号,"['2022-04-05', '2022-04-04']"
黄浦区大林路5弄,"['2022-04-05', '2022-04-03']"
黄浦区大林路78号,"['2022-04-05', '2022-04-03', '2022-04-02']"
黄浦区淡水路214弄,"['2022-04-05', '2022-04-04']"
黄浦区淡水路218号,['2022-04-05']
黄浦区淡水路89弄,"['2022-04-05', '2022-04-03', '2022-04-02', '2022-04-01']"
黄浦区淡水路91弄,"['2022-04-05', '2022-03-22']"
黄浦区滇池路116号,['2022-04-05']
黄浦区滇池路116弄,['2022-04-05']
黄浦区东江阴街184号,['2022-04-05']
黄浦区东江阴街194号,"['2022-04-05', '2022-04-04']"
黄浦区东江阴街220号,['2022-04-05']
黄浦区东街159号,['2022-04-05']
黄浦区东街167弄,['2022-04-05']
黄浦区东街50号,"['2022-04-05', '2022-04-03']"
黄浦区东台路277号,['2022-04-05']
黄浦区方浜西路59号,"['2022-04-05', '2022-04-01']"
黄浦区方浜西路63弄,"['2022-04-05', '2022-04-04', '2022-04-03', '2022-04-01', '2022-03-27']"
黄浦区方斜路548弄,['2022-04-05']
黄浦区方斜支路11号,['2022-04-05']
黄浦区凤阳路200弄,['2022-04-05']
黄浦区凤阳路358弄,"['2022-04-05', '2022-04-04', '2022-03-30']"
黄浦区福建南路33号,['2022-04-05']
黄浦区福建中路225号,['2022-04-05']
黄浦区福州路17号,['2022-04-05']
黄浦区福州路384弄,['2022-04-05']
黄浦区复兴东路1055弄,['2022-04-05']
黄浦区复兴东路248号,['2022-04-05']
黄浦区复兴东路663弄,"['2022-04-05', '2022-04-03', '2022-04-01', '2022-03-29', '2022-03-27']"
黄浦区复兴东路671号,['2022-04-05']
黄浦区复兴东路701弄,['2022-04-05']
黄浦区复兴东路917号,['2022-04-05']
黄浦区复兴东路983弄,['2022-04-05']
黄浦区复兴中路471号,['2022-04-05']
黄浦区复兴中路553弄,"['2022-04-05', '2022-04-04']"
黄浦区复兴中路565弄,"['2022-04-05', '2022-04-04', '2022-04-03', '2022-03-30', '2022-03-29']"
黄浦区傅家街39弄,['2022-04-05']
黄浦区高家弄37弄,"['2022-04-05', '2022-04-01', '2022-03-30']"
黄浦区高家弄54弄,"['2022-04-05', '2022-04-02', '2022-04-01']"
黄浦区高家弄55号,['2022-04-05']
黄浦区高家弄60号,['2022-04-05']
黄浦区高家弄66弄,"['2022-04-05', '2022-04-02', '2022-04-01']"
黄浦区高家弄74号,['2022-04-05']
黄浦区光启路129号,"['2022-04-05', '2022-04-03']"
黄浦区光启路215号,['2022-04-05']
黄浦区光启路99号,['2022-04-05']
黄浦区光启南路73号,['2022-04-05']
黄浦区广东路138号,['2022-04-05']
黄浦区广东路152号,"['2022-04-05', '2022-04-03']"
黄浦区广东路154号,['2022-04-05']
黄浦区广东路240号,['2022-04-05']
黄浦区广东路339号,"['2022-04-05', '2022-04-04', '2022-04-03']"
黄浦区广东路429号,['2022-04-05']
黄浦区广东路652号,['2022-04-05']
黄浦区广东路654号,['2022-04-05']
黄浦区广西北路118弄,"['2022-04-05', '2022-04-04']"
黄浦区广西北路228弄,"['2022-04-05', '2022-04-03']"
黄浦区广西南路23号,"['2022-04-05', '2022-04-04']"
黄浦区贵州路77弄,['2022-04-05']
黄浦区海潮路240弄,"['2022-04-05', '2022-04-03', '2022-04-02', '2022-03-29', '2022-03-27']"
黄浦区海潮路93弄,"['2022-04-05', '2022-04-03', '2022-04-02', '2022-03-29', '2022-03-27']"
黄浦区汉口路766号,"['2022-04-05', '2022-04-04', '2022-04-03']"
黄浦区合肥路199号,"['2022-04-05', '2022-04-04']"
黄浦区合肥路271号,['2022-04-05']
黄浦区合肥路289弄,['2022-04-05']
黄浦区合肥路622号,['2022-04-05']
黄浦区河南南路1001弄,"['2022-04-05', '2022-04-04', '2022-04-03', '2022-03-27']"
黄浦区河南南路1009弄,"['2022-04-05', '2022-04-03']"
黄浦区河南南路368弄,"['2022-04-05', '2022-04-04', '2022-04-03', '2022-03-29']"
黄浦区河南南路398弄,"['2022-04-05', '2022-04-03', '2022-04-01', '2022-03-29']"
黄浦区河南南路555弄,"['2022-04-05', '2022-03-29']"
黄浦区淮海东路89弄,"['2022-04-05', '2022-04-03']"
黄浦区淮海中路526弄,['2022-04-05']
黄浦区淮海中路558号,['2022-04-05']
黄浦区淮海中路593弄,['2022-04-05']
黄浦区淮海中路615号,['2022-04-05']
黄浦区淮海中路637弄,['2022-04-05']
黄浦区淮海中路774号,['2022-04-05']
黄浦区淮海中路927弄,"['2022-04-05', '2022-04-04']"
黄浦区黄陂南路506弄,"['2022-04-05', '2022-04-04', '2022-03-22']"
黄浦区黄陂南路847弄,['2022-04-05']
黄浦区黄河路107弄,"['2022-04-05', '2022-04-03']"
黄浦区黄河路163号,"['2022-04-05', '2022-04-04']"
黄浦区黄河路259弄,['2022-04-05']
黄浦区黄河路281弄,['2022-04-05']
黄浦区黄家路99弄,"['2022-04-05', '2022-04-03', '2022-04-02', '2022-03-29']"
黄浦区黄家阙路120号,['2022-04-05']
黄浦区黄家阙路68弄,"['2022-04-05', '2022-04-04', '2022-04-03', '2022-03-29']"
黄浦区黄家阙路72弄,['2022-04-05']
黄浦区黄家阙路88弄,"['2022-04-05', '2022-04-04']"
黄浦区火腿弄35号,['2022-04-05']
黄浦区吉安路175弄,['2022-04-05']
黄浦区吉安路288号,['2022-04-05']
黄浦区吉安路293弄,['2022-04-05']
黄浦区济南路297号,['2022-04-05']
黄浦区建德路9号,"['2022-04-05', '2022-04-04']"
黄浦区建国西路194号,['2022-04-05']
黄浦区建国西路91弄,"['2022-04-05', '2022-04-04']"
黄浦区建国中路103弄,"['2022-04-05', '2022-04-04', '2022-04-03']"
黄浦区建国中路145号,['2022-04-05']
黄浦区建国中路61弄,['2022-04-05']
黄浦区江西中路135弄,"['2022-04-05', '2022-04-03']"
黄浦区江西中路170号,['2022-04-05']
黄浦区江西中路368号,['2022-04-05']
黄浦区江西中路412弄,"['2022-04-05', '2022-04-04', '2022-04-03', '2022-04-02']"
黄浦区江西中路416号,['2022-04-05']
黄浦区江西中路422号,"['2022-04-05', '2022-04-03']"
黄浦区江西中路452号,['2022-04-05']
黄浦区江西中路460弄,['2022-04-05']
黄浦区江阴街46号,['2022-04-05']
黄浦区江阴路106弄,['2022-04-05']
黄浦区江阴路111弄,['2022-04-05']
黄浦区金陵东路111号,['2022-04-05']
黄浦区金陵西路60号,"['2022-04-05', '2022-04-04']"
黄浦区进贤路138弄,"['2022-04-05', '2022-04-04', '2022-04-03']"
黄浦区静修路101号,['2022-04-05']
黄浦区静修路104弄,"['2022-04-05', '2022-04-04', '2022-04-03']"
黄浦区静修路10弄,"['2022-04-05', '2022-04-02', '2022-03-29']"
黄浦区静修路114弄,"['2022-04-05', '2022-04-03', '2022-04-02', '2022-04-01', '2022-03-30', '2022-03-29', '2022-03-27']"
黄浦区静修路126弄,"['2022-04-05', '2022-04-04', '2022-04-03', '2022-04-02', '2022-03-30', '2022-03-29', '2022-03-27']"
黄浦区静修路12号,"['2022-04-05', '2022-03-29']"
黄浦区静修路146号,['2022-04-05']
黄浦区静修路50弄,"['2022-04-05', '2022-04-03', '2022-04-02']"
黄浦区静修路52号,['2022-04-05']
黄浦区静修路56号,['2022-04-05']
黄浦区静修路64弄,"['2022-04-05', '2022-04-02', '2022-03-30', '2022-03-29']"
黄浦区静修路66号,"['2022-04-05', '2022-03-29']"
黄浦区静修路68号,['2022-04-05']
黄浦区静修路70号,['2022-04-05']
黄浦区静修路79弄,"['2022-04-05', '2022-04-02', '2022-03-30']"
黄浦区静修路85号,"['2022-04-05', '2022-03-30', '2022-03-29']"
黄浦区九江路218号,['2022-04-05']
黄浦区局门路295弄,"['2022-04-05', '2022-04-04']"
黄浦区局门路361弄,"['2022-04-05', '2022-04-03']"
黄浦区局门路400号,"['2022-04-05', '2022-04-03']"
黄浦区局门路405弄,"['2022-04-05', '2022-04-03']"
黄浦区局门路434弄,"['2022-04-05', '2022-04-04', '2022-04-03', '2022-04-01', '2022-03-30']"
黄浦区局门路620号,"['2022-04-05', '2022-04-04']"
黄浦区巨鹿路233号,['2022-04-05']
黄浦区巨鹿路246号,['2022-04-05']
黄浦区老道前街20号,['2022-04-05']
黄浦区老道前街68弄,['2022-04-05']
黄浦区老重庆中路58号,['2022-04-05']
黄浦区丽园路546号,['2022-04-05']
黄浦区丽园路588号,['2022-04-05']
黄浦区丽园路660号,['2022-04-05']
黄浦区丽园路842弄,"['2022-04-05', '2022-04-04', '2022-04-03', '2022-04-02']"
黄浦区丽园路871号,"['2022-04-05', '2022-04-04', '2022-04-03', '2022-03-30', '2022-03-26', '2022-03-24', '2022-03-23']"
黄浦区丽园路873号,"['2022-04-05', '2022-03-27', '2022-03-26', '2022-03-24', '2022-03-23', '2022-03-22']"
黄浦区丽园路875号,"['2022-04-05', '2022-04-04', '2022-03-29', '2022-03-27', '2022-03-23', '2022-03-22']"
黄浦区柳江街19号,"['2022-04-05', '2022-04-02']"
黄浦区鲁班路277弄,"['2022-04-05', '2022-04-02']"
黄浦区鲁班路388弄,['2022-04-05']
黄浦区鲁班路509弄,"['2022-04-05', '2022-04-04', '2022-04-03']"
黄浦区鲁班路721弄,"['2022-04-05', '2022-03-22']"
黄浦区鲁班路738弄,"['2022-04-05', '2022-04-04', '2022-03-30', '2022-03-29']"
黄浦区鲁班路776弄,['2022-04-05']
黄浦区鲁班路778弄,['2022-04-05']
黄浦区陆家浜路1235弄,['2022-04-05']
黄浦区陆家浜路305弄,"['2022-04-05', '2022-04-03']"
黄浦区陆家浜路525号,['2022-04-05']
黄浦区露香园路166号,['2022-04-05']
黄浦区露香园路18号,['2022-04-05']
黄浦区露香园路45弄,['2022-04-05']
黄浦区露香园路88弄,"['2022-04-05', '2022-04-03']"
黄浦区马当路320号,['2022-04-05']
黄浦区马当路418弄,['2022-04-05']
黄浦区马当路444号,"['2022-04-05', '2022-04-04']"
黄浦区茂名南路169弄,['2022-04-05']
黄浦区茂名南路58号,"['2022-04-05', '2022-04-04']"
黄浦区蒙自路395弄,"['2022-04-05', '2022-04-04']"
黄浦区蒙自路490弄,"['2022-04-05', '2022-04-04', '2022-04-01', '2022-03-29']"
黄浦区蒙自路601弄,"['2022-04-05', '2022-04-03', '2022-03-27', '2022-03-24']"
黄浦区蒙自西路14号,"['2022-04-05', '2022-03-23']"
黄浦区蒙自西路2号,"['2022-04-05', '2022-04-03']"
黄浦区梦花街113号,['2022-04-05']
黄浦区梦花街115号,['2022-04-05']
黄浦区梦花街13弄,"['2022-04-05', '2022-04-02', '2022-03-30']"
黄浦区梦花街151号,"['2022-04-05', '2022-04-02']"
黄浦区梦花街163弄,"['2022-04-05', '2022-04-03', '2022-04-02', '2022-04-01', '2022-03-29']"
黄浦区梦花街185号,['2022-04-05']
黄浦区梦花街18弄,['2022-04-05']
黄浦区梦花街234号,"['2022-04-05', '2022-03-29']"
黄浦区梦花街36号,['2022-04-05']
黄浦区梦花街57弄,"['2022-04-05', '2022-03-29']"
黄浦区梦花街66弄,['2022-04-05']
黄浦区梦花街73弄,"['2022-04-05', '2022-03-29']"
黄浦区梦花街78弄,"['2022-04-05', '2022-04-02', '2022-03-29']"
黄浦区梦花街79号,"['2022-04-05', '2022-03-29']"
黄浦区梦花街82号,['2022-04-05']
黄浦区梦花街86号,['2022-04-05']
黄浦区梦花街87号,['2022-04-05']
黄浦区梦花街93弄,"['2022-04-05', '2022-03-29']"
黄浦区面筋弄12弄,['2022-04-05']
黄浦区面筋弄60弄,"['2022-04-05', '2022-04-03', '2022-03-30']"
黄浦区南仓街118号,['2022-04-05']
黄浦区南昌路127弄,['2022-04-05']
黄浦区南昌路137-1号,['2022-04-05']
黄浦区南昌路137号,['2022-04-05']
黄浦区南昌路278弄10号,['2022-04-05']
黄浦区南昌路280号,['2022-04-05']
黄浦区南昌路338号,['2022-04-05']
黄浦区南昌路69弄,['2022-04-05']
黄浦区南京西路479弄,['2022-04-05']
黄浦区宁安路133弄,"['2022-04-05', '2022-04-04']"
黄浦区宁波路120弄,['2022-04-05']
黄浦区宁波路201号,['2022-04-05']
黄浦区宁波路262号,['2022-04-05']
黄浦区宁波路284弄,"['2022-04-05', '2022-04-04']"
黄浦区宁波路579号,['2022-04-05']
黄浦区宁波路645号,['2022-04-05']
黄浦区宁波路74弄,"['2022-04-05', '2022-04-03']"
黄浦区宁海东路250弄,['2022-04-05']
黄浦区宁海东路279弄,"['2022-04-05', '2022-04-02']"
黄浦区宁海东路281号,"['2022-04-05', '2022-04-04']"
黄浦区宁海东路299号,['2022-04-05']
黄浦区牛庄路692号,['2022-04-05']
黄浦区牌楼路23号,['2022-04-05']
黄浦区蓬莱路207号,"['2022-04-05', '2022-04-03']"
黄浦区蓬莱路215弄,['2022-04-05']
黄浦区蓬莱路285弄,['2022-04-05']
黄浦区蓬莱路315号,['2022-04-05']
黄浦区蓬莱路391弄,"['2022-04-05', '2022-04-04']"
黄浦区蓬莱路401号,['2022-04-05']
黄浦区蓬莱路405弄,"['2022-04-05', '2022-04-03', '2022-03-27', '2022-03-24']"
黄浦区蓬莱路421弄,"['2022-04-05', '2022-03-29']"
黄浦区平望街15弄,"['2022-04-05', '2022-04-04']"
黄浦区平望街19号,['2022-04-05']
黄浦区平望街21号,['2022-04-05']
黄浦区平望街23号,"['2022-04-05', '2022-04-04']"
黄浦区平望街6弄,['2022-04-05']
黄浦区平望街9号,"['2022-04-05', '2022-04-04']"
黄浦区普育东路7号,"['2022-04-05', '2022-03-29']"
黄浦区瞿溪路1072弄,"['2022-04-05', '2022-04-04', '2022-04-03', '2022-04-01', '2022-03-30']"
黄浦区瞿溪路1079号,['2022-04-05']
黄浦区瞿溪路1111弄,"['2022-04-05', '2022-04-04', '2022-04-03', '2022-04-02']"
黄浦区瞿溪路1199弄,"['2022-04-05', '2022-04-04', '2022-04-03', '2022-03-29']"
黄浦区瞿溪路1200弄,"['2022-04-05', '2022-04-04', '2022-04-03', '2022-04-02', '2022-04-01', '2022-03-30', '2022-03-29', '2022-03-27']"
黄浦区瞿溪路1240弄,"['2022-04-05', '2022-04-04', '2022-03-29']"
黄浦区瞿溪路1254弄,"['2022-04-05', '2022-04-04']"
黄浦区瞿溪路811弄,"['2022-04-05', '2022-04-04']"
黄浦区瞿溪路833号,"['2022-04-05', '2022-04-04']"
黄浦区瞿溪路860号,['2022-04-05']
黄浦区瞿溪路883弄,['2022-04-05']
黄浦区瞿溪路937弄,"['2022-04-05', '2022-04-03', '2022-04-01', '2022-03-30', '2022-03-22']"
黄浦区瞿溪路968弄,['2022-04-05']
黄浦区人民路777弄,"['2022-04-05', '2022-03-30']"
黄浦区人民路875号,"['2022-04-05', '2022-04-03']"
黄浦区人民路879号,['2022-04-05']
黄浦区瑞金二路129弄,"['2022-04-05', '2022-04-04', '2022-03-29']"
黄浦区瑞金二路139号,['2022-04-05']
黄浦区瑞金二路24号,['2022-04-05']
黄浦区瑞金二路410弄,"['2022-04-05', '2022-04-04', '2022-04-01', '2022-03-30', '2022-03-29', '2022-03-27']"
黄浦区瑞金二路48弄,['2022-04-05']
黄浦区瑞金南路185弄,"['2022-04-05', '2022-04-04', '2022-04-03', '2022-03-29']"
黄浦区瑞金南路333弄,"['2022-04-05', '2022-04-03']"
黄浦区瑞金一路126弄,['2022-04-05']
黄浦区山海关路120号,"['2022-04-05', '2022-04-04']"
黄浦区山海关路130号,['2022-04-05']
黄浦区山西南路181号,['2022-04-05']
黄浦区山西南路31弄,['2022-04-05']
黄浦区山西南路330号,['2022-04-05']
黄浦区陕西南路155号,['2022-04-05']
黄浦区陕西南路255号,['2022-04-05']
黄浦区陕西南路271弄,"['2022-04-05', '2022-04-04', '2022-04-03']"
黄浦区陕西南路287弄,"['2022-04-05', '2022-04-04', '2022-04-03']"
黄浦区尚文路168号,['2022-04-05']
黄浦区绍兴路18弄,['2022-04-05']
黄浦区寿宁路61号,['2022-04-05']
黄浦区顺昌路550弄,"['2022-04-05', '2022-04-04', '2022-04-03', '2022-03-30', '2022-03-27', '2022-03-23']"
黄浦区思南路115弄,['2022-04-05']
黄浦区思南路82弄,"['2022-04-05', '2022-04-03', '2022-03-23', '2022-03-22']"
黄浦区思南路88弄,"['2022-04-05', '2022-04-04']"
黄浦区四牌楼路104号,['2022-04-05']
黄浦区四牌楼路106号,['2022-04-05']
黄浦区四牌楼路110号,"['2022-04-05', '2022-03-22']"
黄浦区四牌楼路114号,"['2022-04-05', '2022-04-03', '2022-03-29']"
黄浦区四牌楼路120号,['2022-04-05']
黄浦区四牌楼路126号,['2022-04-05']
黄浦区四牌楼路75号,['2022-04-05']
黄浦区四牌楼路77弄,['2022-04-05']
黄浦区四牌楼路87号,['2022-04-05']
黄浦区四牌楼路95弄,"['2022-04-05', '2022-04-03', '2022-03-29']"
黄浦区泗泾路16号,['2022-04-05']
黄浦区泗泾路27号,['2022-04-05']
黄浦区泰康路190弄,"['2022-04-05', '2022-04-04']"
黄浦区泰康路220号,"['2022-04-05', '2022-04-03']"
黄浦区桃源路111弄,"['2022-04-05', '2022-04-03']"
黄浦区天津路157弄,['2022-04-05']
黄浦区天津路179弄,"['2022-04-05', '2022-04-04', '2022-04-03', '2022-04-02']"
黄浦区铁道路140号,['2022-04-05']
黄浦区铁道路676号,"['2022-04-05', '2022-04-04']"
黄浦区威海路149号,"['2022-04-05', '2022-04-03']"
黄浦区文庙路33弄,['2022-04-05']
黄浦区文庙路60弄,"['2022-04-05', '2022-04-03', '2022-04-02', '2022-04-01', '2022-03-30']"
黄浦区文庙路85号,['2022-04-05']
黄浦区吴家弄25弄,['2022-04-05']
黄浦区五里桥178号,['2022-04-05']
黄浦区五里桥路269弄,"['2022-04-05', '2022-04-04', '2022-04-03', '2022-03-29']"
黄浦区西仓桥街103弄,['2022-04-05']
黄浦区西仓桥街105号,"['2022-04-05', '2022-04-02']"
黄浦区西仓桥街112弄,"['2022-04-05', '2022-04-04', '2022-04-03', '2022-04-02', '2022-04-01', '2022-03-30', '2022-03-29']"
黄浦区西仓桥街149号,['2022-04-05']
黄浦区西仓桥街161弄,"['2022-04-05', '2022-04-02', '2022-03-30']"
黄浦区西仓桥街82号,['2022-04-05']
黄浦区西仓桥街96号,['2022-04-05']
黄浦区西藏南路1341弄,['2022-04-05']
黄浦区西藏南路1731号,"['2022-04-05', '2022-04-03']"
黄浦区西藏南路500号,['2022-04-05']
黄浦区西藏南路555弄,"['2022-04-05', '2022-04-04']"
黄浦区西藏南路569号,['2022-04-05']
黄浦区西藏南路688号,['2022-04-05']
黄浦区西藏南路688弄,"['2022-04-05', '2022-04-04', '2022-03-29']"
黄浦区西藏南路779号,['2022-04-05']
黄浦区西藏南路831弄,['2022-04-05']
黄浦区西藏南路897号,['2022-04-05']
黄浦区西藏中路200号,['2022-04-05']
黄浦区西藏中路500号,['2022-04-05']
黄浦区西凌家宅路146号,['2022-04-05']
黄浦区西凌家宅路27弄,['2022-04-05']
黄浦区西姚家弄11号,['2022-04-05']
黄浦区西姚家弄21弄,['2022-04-05']
黄浦区西姚家弄27号,"['2022-04-05', '2022-04-04']"
黄浦区西姚家弄51号,['2022-04-05']
黄浦区西姚家弄57号,['2022-04-05']
黄浦区县左街20弄,"['2022-04-05', '2022-04-04', '2022-04-01', '2022-03-30', '2022-03-27']"
黄浦区香港路123号,"['2022-04-05', '2022-04-04']"
黄浦区香港路130号,"['2022-04-05', '2022-04-04']"
黄浦区小桃园街30弄,['2022-04-05']
黄浦区小桃园街40弄,"['2022-04-05', '2022-04-03', '2022-03-29']"
黄浦区小桃园街50弄,"['2022-04-05', '2022-04-04', '2022-04-01', '2022-03-29']"
黄浦区斜土东路197号,['2022-04-05']
黄浦区斜土路102号,['2022-04-05']
黄浦区斜土路118弄,['2022-04-05']
黄浦区斜土路195弄,['2022-04-05']
黄浦区斜土路262弄,['2022-04-05']
黄浦区斜土路280号,['2022-04-05']
黄浦区斜土路298弄,['2022-04-05']
黄浦区斜土路500号,['2022-04-05']
黄浦区斜土路556弄,"['2022-04-05', '2022-04-04']"
黄浦区斜土路734弄,"['2022-04-05', '2022-04-04']"
黄浦区斜土路766弄,['2022-04-05']
黄浦区斜土路80弄,"['2022-04-05', '2022-04-04', '2022-04-02']"
黄浦区斜土路810弄,"['2022-04-05', '2022-03-29']"
黄浦区斜土路85弄,"['2022-04-05', '2022-04-04', '2022-04-03']"
黄浦区新昌路87弄,"['2022-04-05', '2022-04-03']"
黄浦区新桥路52弄,"['2022-04-05', '2022-04-04']"
黄浦区新闸路126号,['2022-04-05']
黄浦区新闸路280号,['2022-04-05']
黄浦区徐家汇路1弄,"['2022-04-05', '2022-04-04', '2022-04-01']"
黄浦区徐家汇路268号,"['2022-04-05', '2022-04-04']"
黄浦区徐家汇路388弄,['2022-04-05']
黄浦区徐家汇路515弄,"['2022-04-05', '2022-04-04', '2022-04-03', '2022-04-01']"
黄浦区徐家汇路536弄,"['2022-04-05', '2022-04-04']"
黄浦区徐家汇路618号,['2022-04-05']
黄浦区学西街19号,"['2022-04-05', '2022-04-02']"
黄浦区学西街1号,['2022-04-05']
黄浦区学院路112弄,['2022-04-05']
黄浦区学院路135号,"['2022-04-05', '2022-03-27']"
黄浦区学院路189号,['2022-04-05']
黄浦区学院路72号,"['2022-04-05', '2022-03-29']"
黄浦区学院路79弄,"['2022-04-05', '2022-04-04', '2022-04-03']"
黄浦区巡道街43弄,['2022-04-05']
黄浦区延安东路1292弄,"['2022-04-05', '2022-04-04']"
黄浦区延安东路429号,"['2022-04-05', '2022-04-04']"
黄浦区延安中路527号,"['2022-04-05', '2022-04-04']"
黄浦区延安中路529弄,['2022-04-05']
黄浦区雁荡路55弄,['2022-04-05']
黄浦区迎勋北路131号,['2022-04-05']
黄浦区永安路2号,['2022-04-05']
黄浦区永年路149弄,"['2022-04-05', '2022-04-04', '2022-04-03', '2022-03-30', '2022-03-29', '2022-03-26', '2022-03-23']"
黄浦区永寿路11号,['2022-04-05']
黄浦区永寿路9弄,['2022-04-05']
黄浦区悦来街38弄,['2022-04-05']
黄浦区张家弄132号,"['2022-04-05', '2022-04-04', '2022-03-29']"
黄浦区长乐路169弄,"['2022-04-05', '2022-04-04', '2022-04-03', '2022-04-01']"
黄浦区长乐路175号,['2022-04-05']
黄浦区长乐路193号,['2022-04-05']
黄浦区肇嘉浜路168弄,"['2022-04-05', '2022-04-04']"
黄浦区肇周路136号,['2022-04-05']
黄浦区肇周路332弄,"['2022-04-05', '2022-04-04']"
黄浦区肇周路342号,['2022-04-05']
黄浦区肇周路384弄,['2022-04-05']
黄浦区浙江南路18号,['2022-04-05']
黄浦区浙江南路78号,"['2022-04-05', '2022-04-04']"
黄浦区浙江南路88号,['2022-04-05']
黄浦区浙江中路167弄,['2022-04-05']
黄浦区浙江中路379号,['2022-04-05']
黄浦区浙江中路400号,['2022-04-05']
黄浦区浙江中路435号,['2022-04-05']
黄浦区制造局路361号,"['2022-04-05', '2022-03-22']"
黄浦区制造局路370弄,['2022-04-05']
黄浦区制造局路466弄,['2022-04-05']
黄浦区中华路1142号,['2022-04-05']
黄浦区中华路1299弄,['2022-04-05']
黄浦区中华路429弄,"['2022-04-05', '2022-04-04', '2022-04-02', '2022-03-26']"
黄浦区中华路518弄,['2022-04-05']
黄浦区中华路868弄,"['2022-04-05', '2022-04-04', '2022-04-02']"
黄浦区中山南路1358弄,"['2022-04-05', '2022-04-03', '2022-04-02', '2022-04-01', '2022-03-29', '2022-03-27']"
黄浦区中山南路36号,['2022-04-05']
黄浦区中山南路566弄,"['2022-04-05', '2022-04-04']"
黄浦区中山南一路1012弄,['2022-04-05']
黄浦区中山南一路1016号,['2022-04-05']
黄浦区中山南一路1043弄,"['2022-04-05', '2022-04-04']"
黄浦区中山南一路1065号,"['2022-04-05', '2022-03-30']"
黄浦区中山南一路1109弄,"['2022-04-05', '2022-04-04', '2022-03-29']"
黄浦区中山南一路500弄,"['2022-04-05', '2022-04-03']"
黄浦区重庆北路177弄,"['2022-04-05', '2022-04-04']"
黄浦区重庆北路318号,['2022-04-05']
黄浦区重庆北路350号,"['2022-04-05', '2022-04-04']"
黄浦区重庆南路229弄,"['2022-04-05', '2022-04-04']"
黄浦区重庆南路298弄,"['2022-04-05', '2022-04-04', '2022-04-03', '2022-04-01', '2022-03-29']"
黄浦区重庆南路30弄,"['2022-04-05', '2022-04-04']"
黄浦区庄家街45弄,"['2022-04-05', '2022-04-03', '2022-04-02', '2022-04-01', '2022-03-29']"
黄浦区庄家街68号,"['2022-04-05', '2022-04-02']"
黄浦区庄家街84号,"['2022-04-05', '2022-04-02']"
